<?xml version="1.0" encoding="iso-8859-1" ?>
<p xmlns:xsi="http://www.w3.org/2001/XMLSchema-instance"  xsi:noNamespaceSchemaLocation="./../../../clase.xsd">

  <q0>Para promover el intercambio de ideas sobre la lectura, el docente pide a los estudiantes que, en la pizarra,
      escriban un título que dé cuenta del tema central abordado conjuntamente en ambos textos. A continuación, se
      presentan las propuestas que escribieron tres estudiantes:</q0>
  <g0>5286-p.png</g0>
  <q>¿Cuál de las propuestas da cuenta del tema central abordado conjuntamente en los textos A y B?</q>
  <g></g>
  <q2></q2>
  <g2></g2>
  <as r="R" correcta="1">
    <a>La de Adela.</a>
    <a>La de Benito.</a>
    <a>La de Camila.</a>
  </as>
  <x>B</x>
  <i></i>
  <x2></x2>
  <i2></i2>
  <v1></v1>
</p>