<?xml version="1.0" encoding="UTF-8" ?>
<p xmlns:xsi="http://www.w3.org/2001/XMLSchema-instance"  xsi:noNamespaceSchemaLocation="./../../../clase.xsd">

    <q0>Texto:</q0>
    <g0>5034-p.png</g0>
    <q>¿Cuál es la intención del texto propuesto?</q>
    <q2></q2>
    <as r="R" correcta="1">
        <a>Entretener</a>
        <a>Informar</a>
        <a>Criticar</a>
        <a>Argumentar</a>
    </as>
    <x>B.</x>
    <i></i>
    <x2></x2>
    <i2></i2>
    <v1></v1>
</p>