<?xml version="1.0" encoding="iso-8859-1" ?>
<p xmlns:xsi="http://www.w3.org/2001/XMLSchema-instance"  xsi:noNamespaceSchemaLocation="./../../../clase.xsd"
 
    <q0>Edgar y Daniel, del aula de cinco años, conversan. Edgar le cuenta a Daniel que ha aprendido a hacer aviones de
        papel. Emocionado, Daniel le pide que le enseñe. Entonces, rápidamente, Edgar coge un libro que está cerca y
        arranca una hoja. En ese momento, interviene la docente.<q0>
    <g0>58.png</g0>
    <q>En esta situación, ¿qué aprendizaje relacionado con el área de Personal Social está promoviendo la docente?</q>
    <g>></g>
    <as r="R" correcta="0">
        <a>Que los niños se aproximen a la noción de bien común.</a>
        <a>Que los niños propongan normas para cuidar los bienes del aula.</a>
        <a>Que los niños se comprometan a reparar el daño ocasionado por sus acciones.</a>
    </as>
    <x>A</x>
    <i></i>
    <x></x>
    <i></i>
    <v1></v1>
</p>