<?xml version="1.0" encoding="UTF-8" ?>
<p xmlns:xsi="http://www.w3.org/2001/XMLSchema-instance"  xsi:noNamespaceSchemaLocation="./../../../clase.xsd">

    <q0></q0>
    <g0></g0>
    <q>Marca la correcta.</q>
    <q2></q2>
    <as r="R" correcta="3">
        <a>Los futbolistas entrenaron mucho para la final del partido; sin embargo; para mí, los resultados no fueron
           los que esperaba, José Villanueva, el entrenador.</a>
        <a>Los futbolistas entrenaron mucho para la final del partido; sin embargo para mí, los resultados no fueron los
           que esperaba José Villanueva, el entrenador.</a>
        <a>Los futbolistas entrenaron mucho para la final del partido; sin embargo, para mí los resultados no fueron los
           que esperaba José Villanueva, el entrenador.</a>
        <a>Los futbolistas entrenaron mucho para la final del partido; sin embargo, para mí, los resultados no fueron
           los que esperaba José Villanueva, el entrenador.</a>
    </as>
    <x>D.</x>
    <i></i>
    <x2></x2>
    <i2></i2>
    <v1></v1>
</p>