<?xml version="1.0" encoding="UTF-8" ?>
<p xmlns:xsi="http://www.w3.org/2001/XMLSchema-instance"  xsi:noNamespaceSchemaLocation="./../../../clase.xsd">

    <q0>Juan, estudiante de 3° grado de EBR tiene dificultades para hacer un balance económico.</q0>
    <g0></g0>
    <q>Después de haber cumplido con ciertas encomendaciones de su señor padre, entonces:</q>
    <as r="R" correcta="1">
        <a>Juan carece de personalidad definida.</a>
        <a>Juan está presente frente a una situación problemática.</a>
        <a>Juan tiene que superar el obstáculo.</a>
        <a>Juan desconoce métodos adecuados de solución.</a>
    </as>
    <x>B.</x>
</p>