<?xml version="1.0" encoding="iso-8859-1" ?>
<p xmlns:xsi="http://www.w3.org/2001/XMLSchema-instance"  xsi:noNamespaceSchemaLocation="./../../../clase.xsd">

  <q0></q0>
  <g0>./../preguntas/nom/2edfisicaprim/200-300_2019/nom-efp-2268-p.png</g0>
  <q>¿Qué estilo de enseñanza está aplicando el docente cuando designa a algunos estudiantes como monitores?</q>
  <g></g>
  <q2></q2>
  <g2></g2>
  <as r="R" correcta="1">
    <a>Resolución de problemas.</a>
    <a>Enseñanza recíproca.</a>
    <a>Microenseñanza.</a>
  </as>
  <x>B</x>
  <i></i>
  <x2></x2>
  <i2></i2>
  <v1></v1>
</p>