<?xml version="1.0" encoding="UTF-8" ?>
<p xmlns:xsi="http://www.w3.org/2001/XMLSchema-instance"  xsi:noNamespaceSchemaLocation="./../../../clase.xsd">

  <q0></q0>
  <g0></g0>
  <q>¿Qué información brinda la relación entre el peso y talla de los estudiantes, y su edad?</q>
  <g></g>
  <q2></q2>
  <g2></g2>
  <as r="R" correcta="1">
    <a>Información sobre su estado físico.</a>
    <a>Información sobre su estado nutricional.</a>
    <a>Información sobre su índice de masa corporal.</a>
  </as>
  <x>B</x>
  <i></i>
  <x2></x2>
  <i2></i2>
  <v1></v1>
</p>