<?xml version="1.0" encoding="iso-8859-1" ?>
<p xmlns:xsi="http://www.w3.org/2001/XMLSchema-instance"  xsi:noNamespaceSchemaLocation="./../../../clase.xsd">

    <q0></q0>
    <g0>./../../preguntas/nom/0inicial/100-200_2018/nom-ini-188-p.png</g0>
    <q>¿Cuál de las siguientes preguntas es pertinente para que los niños realicen inferencias sobre este fragmento?</q>
    <q2></q2>
    <as r="R" correcta="1">
        <a>¿Cómo eran las barbas del viejo bagre?</a>
        <a>¿Por qué se sentía orgulloso el viejo bagre?</a>
        <a>¿Qué piensan de la preocupación de la mamá del bagrecico?</a>
    </as>
    <x>B.</x>
    <i></i>
    <x2></x2>
    <i2></i2>
    <v1></v1>
</p>