<?xml version="1.0" encoding="UTF-8" ?>
<p xmlns:xsi="http://www.w3.org/2001/XMLSchema-instance"  xsi:noNamespaceSchemaLocation="./../../../clase.xsd">

    <q0></q0>
    <g0></g0>
    <q>¿Qué competencia se está desarrollando predominantemente en la sesión descrita?</q>
    <g></g>
    <q2></q2>
    <g2></g2>
    <as r="R" correcta="0">
        <a>¿Qué competencia se está desarrollando predominantemente en la sesión descrita?</a>
        <a>Interactúa a través de sus habilidades sociomotrices.</a>
        <a>Se desenvuelve de manera autónoma a través de su motricidad.</a>
    </as>
    <x>A</x> <v1></v1>
    <i></i>
    <x2></x2>
    <i2></i2>
    <v></v>
</p>