<?xml version="1.0" encoding="iso-8859-1" ?>
<p xmlns:xsi="http://www.w3.org/2001/XMLSchema-instance"  xsi:noNamespaceSchemaLocation="./../../../clase.xsd">

	<q0>Aprovechando que en la IE se ha realizado hace poco la final del campeonato de fútbol en el
marco de las olimpiadas escolares, un docente del ciclo IV ha decidido aprovechar la situación
para realizar la siguiente actividad:</q0>
	<g0>62-p.png</g0>
	<q>Si el propósito del docente es favorecer que los estudiantes se inicien en el desarrollo de la
capacidad de interpretación crítica de fuentes,</q>
	<q2>¿por qué la actividad planteada es pertinente
para este propósito?</q2>
	<as r="R" correcta="2">
		<a>Porque ayuda a que los estudiantes expliquen por qué los testimonios orales pueden ser
fuentes menos fiables que las fuentes escritas.</a>
		<a>Porque ayuda a que los estudiantes identifiquen fuentes que ofrecen relatos auténticos
para explicar un determinado hecho.</a>
		<a>Porque ayuda a que los estudiantes reconozcan que de un mismo hecho pueden derivarse
diferentes narraciones sobre él.</a>
	</as>	
	<x>C.</x>
	<i></i>
	<x2>
	</x2>
	<i2></i2>
	<v1></v1>
</p>