<?xml version="1.0" encoding="iso-8859-1" ?>
<p xmlns:xsi="http://www.w3.org/2001/XMLSchema-instance"  xsi:noNamespaceSchemaLocation="./../../../clase.xsd">

  <q0>Patricia, una de las estudiantes, ha expuesto la primera intervención que ha preparado para el debate frente a sus
      compañeros de equipo. Ellos le ofrecieron diversos comentarios sobre su texto oral. A continuación, se muestra la
      transcripción de tres de los comentarios:</q0>
  <g0>5290-p.png</g0>
  <q>¿Cuál de estos comentarios se centra en resaltar la utilización estratégica de recursos paraverbales en el texto
     oral de Patricia?</q>
  <g></g>
  <q2></q2>
  <g2></g2>
  <as r="R" correcta="2">
    <a>El 1.</a>
    <a>El 2.</a>
    <a>El 3.</a>
  </as>
  <x>C</x>
  <i></i>
  <x2></x2>
  <i2></i2>
  <v1></v1>
</p>