<?xml version="1.0" encoding="iso-8859-1" ?>
<p xmlns:xsi="http://www.w3.org/2001/XMLSchema-instance"  xsi:noNamespaceSchemaLocation="./../../../clase.xsd">

  <q0></q0>
  <g0></g0>
  <q>¿Qué enfoque transversal del currículo se evidencia principalmente en la intervención del docente?</q>
  <g></g>
  <q2></q2>
  <g2></g2>
  <as r="R" correcta="0">
    <a>Búsqueda de la excelencia.</a>
    <a>Orientación al bien común.</a>
    <a>Inclusivo o de atención a la diversidad.</a>
  </as>
  <x>A</x>
  <i></i>
  <x2></x2>
  <i2></i2>
  <v1></v1>
</p>