<?xml version="1.0" encoding="iso-8859-1" ?>
<p xmlns:xsi="http://www.w3.org/2001/XMLSchema-instance"  xsi:noNamespaceSchemaLocation="./../../../clase.xsd">

    <q0>Texto:</q0>
    <g0>5831-p.png</g0>
    <q>A partir de la lectura del gráfico, determine la alternativa correcta.</q>
    <q2></q2>
    <as r="R" correcta="1">
        <a>En el Perú, el índice de competitividad de las regiones de la sierra sur muestra un deterioro moderado en los
           últimos años.</a>
        <a>En cuanto a los resultados competitividad regional, existe una brecha significativa entre la capital y el
           resto del país.</a>
        <a>La región del Callao ha tenido los mejores resultados de competitividad en comparación con la capital del
           país.</a>
        <a>Las regiones de Cajamarca y Amazonas han disminuido su producción agropecuaria en los últimos tres años.</a>
        <a>Hay un centralismo político y administrativo en la ciudad de Lima y en las diversas capitales de provincia.</a>
    </as>
    <x>B.</x>
    <i></i>
    <x2>Con relación a los resultados de competitividad regional, resulta correcto aseverar que existe una brecha
        significativa, o sea, una notoria diferencia entre la capital y el resto del país. En el gráfico podemos notar
        que Lima presenta un índice de 73,43 en el 2016, muy por encima de regiones como Arequipa (43,44), Ayacucho
        (26,84) y Huancavelica (20). Por lo tanto, podemos confirmar que la diferencia entre estas cifras es muy
        significativa.</x2>
    <i2></i2>
    <v1></v1>
</p>