<?xml version="1.0" encoding="UTF-8" ?>
<p xmlns:xsi="http://www.w3.org/2001/XMLSchema-instance"  xsi:noNamespaceSchemaLocation="./../../../clase.xsd">

    <q0>Lea la siguiente situación y responda</q0>
    <g0>4254-p.png</g0>
    <q>El docente ha identificado aspectos que los estudiantes aún deben mejorar en su plan de indagación. ¿Qué grupo de
       preguntas es pertinente que plantee el docente para retroalimentar a los estudiantes sobre estos aspectos?</q>
    <g></g>
    <q2></q2>
    <g2></g2>
    <as r="R" correcta="2">
        <a>¿En qué rango de tiempo se llevará a cabo cada reacción? ¿En cuál de los ensayos ocurrirá más rápido la
           reacción?</a>
        <a>¿Qué sucederá si emplean otro tipo de antiácido? ¿Cómo cambiará la velocidad de la reacción si disminuyen la
           temperatura?</a>
        <a>¿Cuáles son las posibles fuentes de error de su indagación y cómo pueden reducirlas? ¿Cómo pueden evaluar la
           confiabilidad de sus resultados?</a>
    </as>
    <x>C</x>
    <i></i>
    <x2></x2>
    <i2></i2>
    <v1></v1>
</p>