<?xml version="1.0" encoding="iso-8859-1" ?>
<p xmlns:xsi="http://www.w3.org/2001/XMLSchema-instance"  xsi:noNamespaceSchemaLocation="./../../../clase.xsd">

    <q0>Texto:</q0>
    <g0>5034-p.png</g0>
    <q>Se puede afirmar:</q>
    <q2></q2>
    <as r="R" correcta="3">
        <a>El rey Luis XV realmente se enamoró de su antigua amante.</a>
        <a>En la festividad, solo las mujeres de las clases altas portaban un pañuelo.</a>
        <a>El rey portaba una máscara, él era la única persona que cubría su rostro.</a>
        <a>Mujeres de todas las clases tenían las mismas oportunidades de convertirse en la próxima amante del rey.</a>
    </as>
    <x>D.</x>
    <i></i>
    <x2></x2>
    <i2></i2>
    <v1></v1>
</p>