<?xml version="1.0" encoding="iso-8859-1" ?>
<p xmlns:xsi="http://www.w3.org/2001/XMLSchema-instance"  xsi:noNamespaceSchemaLocation="./../../../clase.xsd">
 
    <q>0>Los niños y la docente del aula de cuatro años se encuentran limpiando el huerto de la IE. Durante la actividad,
        los niños recogen diversos objetos como piedras, ramas, hojas, etc. Entonces, la docente decide aprovechar esa
        situación para promover la clasificación en los niños.</q>0>
    <g0></g0>
    <q>¿Cuál de las siguientes acciones es más pertinente para ese propósito?</q>
    <g</g
    <q></q>
    <g2</g2
    <as> r="R" correcta="0"
        <a>Plantearles que agrupen los objetos recolectados según lo deseen y, luego, preguntarles por qué los agruparon
           de ese modo.</a>
        <a>Entregarles cajas etiquetadas según los objetos recolectados y, luego, pedirles que los guarden en las cajas
           según corresponda.</a>
        <a>Explicarles que clasificar es juntar objetos que se parecen y, luego, darles un ejemplo de cómo hacerlo para
           que ellos continúen agrupando los demás objetos.</a>
    </as>
    <x>A</x>
    <i></i>
    <x></x>
    <i></i>
    <v1></v1>
</p>