<?xml version="1.0" encoding="UTF-8" ?>
<p xmlns:xsi="http://www.w3.org/2001/XMLSchema-instance"  xsi:noNamespaceSchemaLocation="./../../../clase.xsd">

    <q0></q0>
    <g0></g0>
    <q>¿Qué es una "triada" en teoría musical?</q>
    <g></g>
    <q2></q2>
    <g2></g2>
    <as r="R" correcta="0">
        <a>Un acorde compuesto por tres notas.</a>
        <a>Una organización del pulso en tres tiempos por compás.</a>
        <a>Una subdivisión del tiempo en tres unidades iguales en compases simples.</a>
    </as>
    <x>A</x>
    <i></i>
    <x2></x2>
    <i2></i2>
    <v1></v1>
</p>